{
  "artifact": {
    "filename": "agent_zero_trust-0.1.8-py3-none-any.whl",
    "sha256": "e78563ae06c27125fb5171cefcaf49290ab7df5b6de43839b67123c6e7a638ca"
  },
  "backend": {
    "name": null,
    "runtime_trials": 0,
    "version": null
  },
  "cases": [
    {
      "actual_exit": 1,
      "azt_observed": {
        "decision": "deny",
        "findings": [
          {
            "description": "Pipe-to-shell: downloads and executes remote code in one step",
            "excerpt": "[content omitted; inspect the indicated file locally]",
            "line": 1,
            "path": "attack.md",
            "rule": "net.pipe_shell",
            "severity": "HIGH"
          },
          {
            "description": "Network fetch to a non-allowlisted host in an instruction/setup context",
            "excerpt": "[content omitted; inspect the indicated file locally]",
            "line": 1,
            "path": "attack.md",
            "rule": "net.fetch_unknown",
            "severity": "MEDIUM"
          }
        ],
        "input_digest": "1db3c4b8ab9a3cd20314042f6ab96ed0cfda5cccc5acd9d99bd13fb08f5bdb22",
        "inventory": [],
        "manifest": [
          {
            "executable": false,
            "kind": "file",
            "path": ".azt-ignore",
            "sha256": "6638464e2ec197c7bc7e43ddb12b46eb6e790aa00ae93acae926d6ab7bb95070"
          },
          {
            "executable": false,
            "kind": "file",
            "path": "arithmetic.py",
            "sha256": "e1a894022d1a082987b87adecb623438c9e386d86b2b621cff4a5fe7fdf7edc8"
          },
          {
            "executable": false,
            "kind": "file",
            "path": "attack.md",
            "sha256": "d543ec1560ba60bc4279b451610d375b206339c0b5dba58f7d6c784877429fa6"
          }
        ],
        "policy": {
          "digest": "5daa23de347bbd6b6c82a8382b5604820b4e0eed4b7e3ee73d11ccd2a5967318",
          "source": "built-in"
        },
        "schema_version": 1,
        "scope": {
          "builtin_excluded_directories": [
            ".git",
            ".mypy_cache",
            ".next",
            ".tox",
            ".venv",
            "__pycache__",
            "build",
            "dist",
            "node_modules",
            "target",
            "venv"
          ],
          "bytes_read": 88,
          "complete": true,
          "errors": [],
          "inspected": [
            {
              "analyses": [
                "text-patterns"
              ],
              "path": ".azt-ignore"
            },
            {
              "analyses": [
                "text-patterns"
              ],
              "path": "arithmetic.py"
            },
            {
              "analyses": [
                "text-patterns"
              ],
              "path": "attack.md"
            }
          ],
          "limits": {
            "depth": 64,
            "entries": 10000,
            "file_bytes": 1000000,
            "findings": 10000,
            "line_characters": 4096,
            "total_bytes": 32000000
          },
          "skipped": [],
          "text_extensions": [
            "",
            ".bash",
            ".cfg",
            ".envrc",
            ".ini",
            ".js",
            ".json",
            ".md",
            ".mdc",
            ".py",
            ".sh",
            ".toml",
            ".ts",
            ".txt",
            ".yaml",
            ".yml",
            ".zsh"
          ]
        },
        "suppressed_findings": [],
        "target_requests": [
          {
            "path": ".azt-ignore",
            "requested_lines": 1,
            "sha256": "6638464e2ec197c7bc7e43ddb12b46eb6e790aa00ae93acae926d6ab7bb95070",
            "status": "untrusted; not applied"
          }
        ],
        "threshold": "high",
        "version": "0.1.8"
      },
      "elapsed_seconds": 0.1853,
      "evaluator_verified": {
        "exit_matches": true,
        "required_finding_present": true,
        "valid_json": true
      },
      "expected_exit": 1,
      "name": "target_cannot_suppress_attack",
      "status": "passed",
      "workload_claim": null
    },
    {
      "actual_exit": 2,
      "azt_observed": {
        "decision": "deny",
        "error": "gate blocked: receipt missing, invalid, expired, or snapshot changed. Legacy workspace markers are not accepted. Review and re-admit from an operator terminal using scan --gate with the same --state-dir, --policy, and --fail-on.",
        "schema_version": 1,
        "version": "0.1.8"
      },
      "elapsed_seconds": 0.0444,
      "evaluator_verified": {
        "exit_matches": true,
        "valid_json": true
      },
      "expected_exit": 2,
      "name": "forged_legacy_admission_rejected",
      "status": "passed",
      "workload_claim": null
    },
    {
      "actual_exit": 0,
      "azt_observed": {
        "decision": "installed",
        "limitation": "Workflow hook only; same-user code can alter hook, policy, and issuer key.",
        "next": "Run scan --gate with the same state directory and policy from an operator terminal before starting the agent.",
        "schema_version": 1
      },
      "elapsed_seconds": 0.045,
      "evaluator_verified": {
        "exit_matches": true,
        "valid_json": true
      },
      "expected_exit": 0,
      "name": "first_install",
      "status": "passed",
      "workload_claim": null
    },
    {
      "actual_exit": 0,
      "azt_observed": {
        "admission": {
          "authentication": {
            "algorithm": "HMAC-SHA256",
            "tag": "fffaf47f5601661b03f00aa1d0055f89e29eea1cdd29c7680fb9dd7e1ac333fe"
          },
          "payload": {
            "engine_digest": "90a1083ce07a7d89e8bfe87136f7415ec6f4ccf19a4cb13355e37c09c650f5c3",
            "engine_version": "0.1.8",
            "event": "snapshot_admitted",
            "expires_at": 1789418879,
            "input_digest": "5f101ca95cc6058742bfcd55f8ebb355b0f50c551e2eb9074e321ff6461918d3",
            "issued_at": 1789415279,
            "observation": "static input inspection only",
            "outcome": "pass",
            "policy": {
              "digest": "5daa23de347bbd6b6c82a8382b5604820b4e0eed4b7e3ee73d11ccd2a5967318",
              "source": "built-in"
            },
            "receipt_id": "6a51bff083f625077f7b36d9ba11559c",
            "schema_version": 1,
            "scope_digest": "dd656ad396e6164b62c00d1578a49315332101bde5718c6e41921d45c605a7d4",
            "threshold": "high",
            "workspace_id": "182bb853d0b5f1100be0bcb05f3d01a4ec2e68ab18d65edbeca50552b966fedf"
          }
        },
        "decision": "pass",
        "findings": [
          {
            "description": "Claude hook declaration; review the command locally",
            "excerpt": "[content omitted; inspect the indicated file locally]",
            "line": 0,
            "path": ".claude/settings.json",
            "rule": "hooks.claude",
            "severity": "MEDIUM"
          }
        ],
        "input_digest": "5f101ca95cc6058742bfcd55f8ebb355b0f50c551e2eb9074e321ff6461918d3",
        "inventory": [
          {
            "class": "agent_settings",
            "path": ".claude/settings.json",
            "severity": "MEDIUM",
            "why": "can define hooks that execute shell commands on agent events"
          }
        ],
        "manifest": [
          {
            "kind": "directory",
            "path": ".claude"
          },
          {
            "executable": false,
            "kind": "file",
            "path": ".claude/settings.json",
            "sha256": "dbe939e4f09c9fef2efe749c2710a550538494a3edc1880197215bdd79548243"
          },
          {
            "executable": false,
            "kind": "file",
            "path": "arithmetic.py",
            "sha256": "e1a894022d1a082987b87adecb623438c9e386d86b2b621cff4a5fe7fdf7edc8"
          }
        ],
        "policy": {
          "digest": "5daa23de347bbd6b6c82a8382b5604820b4e0eed4b7e3ee73d11ccd2a5967318",
          "source": "built-in"
        },
        "schema_version": 1,
        "scope": {
          "builtin_excluded_directories": [
            ".git",
            ".mypy_cache",
            ".next",
            ".tox",
            ".venv",
            "__pycache__",
            "build",
            "dist",
            "node_modules",
            "target",
            "venv"
          ],
          "bytes_read": 630,
          "complete": true,
          "errors": [],
          "inspected": [
            {
              "analyses": [
                "text-patterns",
                "scan_claude_settings"
              ],
              "path": ".claude/settings.json"
            },
            {
              "analyses": [
                "text-patterns"
              ],
              "path": "arithmetic.py"
            }
          ],
          "limits": {
            "depth": 64,
            "entries": 10000,
            "file_bytes": 1000000,
            "findings": 10000,
            "line_characters": 4096,
            "total_bytes": 32000000
          },
          "skipped": [],
          "text_extensions": [
            "",
            ".bash",
            ".cfg",
            ".envrc",
            ".ini",
            ".js",
            ".json",
            ".md",
            ".mdc",
            ".py",
            ".sh",
            ".toml",
            ".ts",
            ".txt",
            ".yaml",
            ".yml",
            ".zsh"
          ]
        },
        "suppressed_findings": [],
        "target_requests": [],
        "threshold": "high",
        "version": "0.1.8"
      },
      "elapsed_seconds": 0.0448,
      "evaluator_verified": {
        "exit_matches": true,
        "valid_json": true
      },
      "expected_exit": 0,
      "name": "first_admission",
      "status": "passed",
      "workload_claim": null
    },
    {
      "actual_exit": 0,
      "azt_observed": {